{
  "$schema": "http://json-schema.org/draft-07/schema#",
  "title": "Agent Variant Configuration",
  "description": "Configuration for vendor-specific agent generation from core prompts",
  "type": "object",
  "required": ["vendor", "destDir", "modelDefault", "toolsDefault", "protocolPath", "agents"],
  "properties": {
    "$schema": {
      "type": "string"
    },
    "vendor": {
      "type": "string",
      "description": "The target CLI vendor name (e.g., gemini, claude)"
    },
    "destDir": {
      "type": "string",
      "description": "The relative path to the directory where generated agent files will be saved"
    },
    "modelDefault": {
      "type": "string",
      "description": "The default AI model to use for this vendor's agents"
    },
    "maxTurnsDefault": {
      "type": "integer",
      "description": "The default maximum number of turns allowed for agents"
    },
    "toolsDefault": {
      "oneOf": [
        {
          "type": "array",
          "items": { "type": "string" }
        },
        {
          "type": "string"
        }
      ],
      "description": "The default set of tools (abstract or vendor-specific) for agents"
    },
    "protocolPath": {
      "type": "string",
      "description": "The path to the vendor-specific execution protocol markdown file"
    },
    "agents": {
      "type": "object",
      "description": "Map of agent-id to vendor-specific overrides",
      "additionalProperties": {
        "type": "object",
        "properties": {
          "tools": {
            "oneOf": [
              {
                "type": "array",
                "items": { "type": "string" }
              },
              {
                "type": "string"
              }
            ]
          },
          "model": {
            "type": "string"
          },
          "maxTurns": {
            "type": "integer"
          },
          "effort": {
            "type": "string",
            "enum": ["low", "medium", "high"]
          },
          "extra": {
            "type": "object",
            "description": "Arbitrary vendor-specific frontmatter fields (e.g., mcpServers)"
          }
        }
      }
    }
  }
}
