{
  "$schema": "./agent-variant.schema.json",
  "vendor": "claude",
  "destDir": ".claude/agents",
  "modelDefault": "sonnet",
  "maxTurnsDefault": 20,
  "toolsDefault": "Read, Write, Edit, Bash, Grep, Glob",
  "protocolPath": ".agents/skills/_shared/runtime/execution-protocols/claude.md",
  "agents": {
    "backend-engineer": {},
    "frontend-engineer": {},
    "db-engineer": {
      "maxTurns": 15
    },
    "debug-investigator": {
      "maxTurns": 15
    },
    "mobile-engineer": {},
    "pm-planner": {
      "tools": "Read, Write, Grep, Glob, Bash",
      "maxTurns": 10
    },
    "qa-reviewer": {
      "tools": "Read, Grep, Glob, Bash",
      "maxTurns": 15,
      "effort": "low"
    }
  }
}
